Job Title,Company,Location,Posting Date,Extract Date,Salary,Summary,JobUrl
Financial Data Business Analyst - Tai Seng,Rentokil Initial,North-East Singapore,Posted30+ days ago,2022-05-18,,"5 years of data/ business analyst experience and 3 years of reporting.
Recommend ways to improve data quality, process improvement and understand business value…",https://sg.indeed.com/rc/clk?jk=3ecb3ba7e891588e&fccid=dd1bd75deed83e84&vjs=3
"Partner Customer Engineer, Data Analytics, Tech ISV Partners",Google,Singapore,Posted5 days ago,2022-05-18,,"Experience in technical selling role/field, such as analyst, data engineer, data scientist, machine learning engineer, etc.",https://sg.indeed.com/rc/clk?jk=258fff8480c5f917&fccid=a5b4499d9e91a5c6&vjs=3
Product & Data Analytics Intern,Wego Pte Ltd,Remote in Singapore,Posted30+ days ago,2022-05-18,"$1,000 - $1,500 a month","As a product analyst intern at Wego, you will work closely with the VP of Product and help conduct a range of data-driven analysis including:",https://sg.indeed.com/rc/clk?jk=86f86b31d6bbae2b&fccid=2eb767878cfa2ae2&vjs=3
Business Analyst/Consultant,VERTICURL PTE. LTD.,Singapore,Posted11 days ago,2022-05-18,"$4,800 - $6,000 a month","Analyse data and develop data models & insights.
Min. 2 years of experience in data-driven marketing and digital media planning and buying.",https://sg.indeed.com/rc/clk?jk=008a4132186a0188&fccid=de94633cf98d26e3&vjs=3
Human Resources Information System Data Analyst,Xylem,Singapore,Posted30+ days ago,2022-05-18,,"2-3 years proven working experience as a data analyst or business data analyst.
Review ongoing data integrity reports and follow up with appropriate…",https://sg.indeed.com/rc/clk?jk=cac0595a4e617109&fccid=68ec8a8ee6cf5ac6&vjs=3
"Manager, Data Analysis",Standard Chartered,Singapore,Posted9 days ago,2022-05-18,,"SQL Skills - Must be able to write queries to extract data needed for client requests, create queries to validate campaign audiences, and construct queries…",https://sg.indeed.com/rc/clk?jk=a972a0dfe8dc4869&fccid=5249cd8e17163cb5&vjs=3
Regional Fulfillment Operations - SPX (Junior Analyst),Shopee,Singapore 118265,Posted30+ days ago,2022-05-18,,"Experience with SQL and Python are preferred; geospatial data analysis skills are advantageous.
Interest to build broad capabilities in strategy, operations,…",https://sg.indeed.com/rc/clk?jk=6fce969a1daaa7dc&fccid=0b476c4a7add47fe&vjs=3
"Statistical Specialist (Data Analytics), Data Collection - MRSD",Ministry of Manpower,Singapore,Posted30+ days ago,2022-05-18,,"Monitor the data and provide constant analysis as a feedback loop to the different functions (data collection, data validation, methodology, etc.).",https://sg.indeed.com/rc/clk?jk=442b6430482ffdb8&fccid=6756c7879f63793f&vjs=3
Research Assistant (Data Analytics),National University of Singapore,Temporarily Remote in Singapore 119077,Posted9 days ago,2022-05-18,,Conduct data management and analysis in the context of PANDA’s (PHYSICAL ACTIVITY AND NUTRITION DETERMINANTS IN ASIA PROGRAMME) digital health projects and…,https://sg.indeed.com/rc/clk?jk=b714e00b2813053e&fccid=b4c06e8a712feddf&vjs=3
"Data Analyst, Mobile",2K,Singapore,Posted30+ days ago,2022-05-18,,"We're looking for an analyst who is eager to mine data for insights, hypothesis driven and experienced with using data-driven techniques to test the hypotheses…",https://sg.indeed.com/rc/clk?jk=928768b80dacac78&fccid=824f64d0ff3c8c8f&vjs=3
Data Capability Analyst,Citi,Singapore,Posted12 days ago,2022-05-18,,"This function covers incumbents responsible for various data activities, which include database administration, data analysis, maintenance, data quality, and…",https://sg.indeed.com/rc/clk?jk=6dc04020dd018f07&fccid=5bcd1ef0a7f4fb99&vjs=3
Programmatic Media Analyst (Singapore),StackAdapt,Remote in Singapore,Posted30+ days ago,2022-05-18,,"Using SQL to extract data from the backend and further analyze, model, and interpret data, automate repetitive data pulls using R.",https://sg.indeed.com/rc/clk?jk=1822af71364f305e&fccid=8125fd19a28b99fe&vjs=3
Data Analyst Intern (6 months internship),FCM,Singapore,Posted30+ days ago,2022-05-18,,"Demonstrable knowledge and experience with data, analytics & reporting workflow, data collection, databases, data mining, data analytics and reporting.",https://sg.indeed.com/rc/clk?jk=a89bca2275b84c47&fccid=249dc1a2c75a0223&vjs=3
Senior Data Analyst (B2C),Page Personnel,Singapore,Posted30+ days ago,2022-05-18,"$3,000 - $4,000 a month","Collect, filter, and aggregate data based on needs to assess data validity.
Assist in maintenance and management of data systems.",https://sg.indeed.com/pagead/clk?mo=r&ad=-6NYlbfkN0BgenUtAy7N8vpHOUDnMIJ_LW6qlj4SiUZjYZ0pCX0SCeObUAX_MtiNFXEPPh4YjND0fW-j41QLoSiWOJqgmhqZW4MNNByURgJjaL77j4DQGZyVDfVHDYdyGe0DBlIG4UWhxuF6ELSDAiQpOYqNYqM4hKPQBoSXA7DyP7CrBfvoZZW22s2uQ4K43J-l41T8MV1lmCJ745WzEcRrfz6P1wCs1M2utzzZ_HNpZLCjDmo7MV55VbkhSKY7KK13ygOIEWXAvHvizeARkSKx1RDgI48HN-mwU0a-ud91p5PnZEnwwBkkgSrlyRI3uvhYfH5LxS1im6jhbeeeMxT0nCIW_OBbnMLuEmEDPR-jfEULzGTlbvw0S8gxVyKGgZB-YYwqulyJyAGhL6M9fEMYPveP4asf1MjGieABQYFI6MOzvrCvQOJQlCgFd6H285K0zeWRsuWHidQExEuSEe50T7iIeO5lWvfO8H-gUg7af2Jii8W4nmrPKw6aMXFt1Jl0U8NVTxYOG41tiWtHFV_NIAytnvKEThBy_D_DB1lraIiZWqNVcIJxW2Z-HGW_IeAbxGbYdUFkLTfgj3kXdtJ-De4FbSSmcUMG9CWB2Hr7aiPFiJGxTDu3GiBSCN6FZb92ajajnG11eL5ypXn95qQesjBmAyUSNJ2tZStuVra8dNIlhrwXpwAAS0tWTLWIi_rVmZhiwAt-557pZNnI1VyczzWtfGWRTJYEzR6vVE0=&p=5&fvj=0&vjs=3
"Analyst, Collector, Risk Management Group",DBS Bank,Singapore,Posted22 days ago,2022-05-18,,To maximise the recovery of past due outstanding by taking effective and persistent collection actions against past due account holders.,https://sg.indeed.com/rc/clk?jk=049a96cd0a9ae87d&fccid=cc1f9ea511d140fe&vjs=3
"Technician, TSE SBL Data Analytics",Micron,Singapore,Posted30+ days ago,2022-05-18,,"Collaborate with partners, domain specialists, information systems, and data science teams to develop enhanced system capabilities.",https://sg.indeed.com/rc/clk?jk=4960534c833420bc&fccid=be240c643a8631c5&vjs=3
Apps Support Intermediate Analyst,Citi,Singapore,Posted6 days ago,2022-05-18,,"Applies professional judgment when interpreting data and results.
Applies analytical thinking and knowledge of data analysis tools and methodologies.",https://sg.indeed.com/rc/clk?jk=acc79491261c0776&fccid=5bcd1ef0a7f4fb99&vjs=3
Data Analyst,Good Job Creations Pte Ltd,Singapore,Hiring ongoing,2022-05-18,,"O Hypothesis validation with the data (Hypothesis condition & Actual performance correlation).
In-depth analysis by using running SQL query on the raw data…",https://sg.indeed.com/company/Good-Job-Creations-Pte-Ltd/jobs/Data-Analyst-8d688efba4b18d88?fccid=ee772c366e311477&vjs=3
System Analyst (BI & Data Management),TransitLink,Singapore,Posted30+ days ago,2022-05-18,,"Design and develop enterprise reports and dashboards with Business Intelligent tool, that utilize the underlying data stores, data warehouse or data marts to…",https://sg.indeed.com/rc/clk?jk=05d83e07dd3e56cf&fccid=7d6ffe420eedb6f7&vjs=3
Senior DEC Analyst (Delivery Excellence),Nike,Singapore,Posted26 days ago,2022-05-18,,"O Lead OTP tracking for Sample/Inline/Promo and delivery MI data validation.
O Support Global DEC projects and data analysis/reporting for strategic initiatives…",https://sg.indeed.com/rc/clk?jk=21ce184b63ba6eff&fccid=2c62e4de04b8f952&vjs=3
Investor Relations – Operations Analyst,Validus Capital Pte Ltd,Singapore,Posted30+ days ago,2022-05-18,,"Development of reporting and analytics dashboards in conjunction with technology, data, and finance teams.
An Investor Relations – Operations Analyst will have…",https://sg.indeed.com/rc/clk?jk=6acbb358464cb5ef&fccid=5b2a63910cc7da06&vjs=3
FP&A Analyst,EMBED,Remote in Toa Payoh,EmployerActive 22 days ago,2022-05-18,"$60,000 - $65,000 a year","Competent in data visualization tools like Power BI/Tableau.
Able to work with big data and create financial models- SQL or other similar programming skills…",https://sg.indeed.com/company/EMBED/jobs/Fp-Analyst-e366c527dcbaaef6?fccid=f366b183449d00f5&vjs=3
Internship(Business Analyst),Titansoft Singapore,Singapore,Posted30+ days ago,2022-05-18,,"Acquiring the ability to analyze and draw insights in an ambiguous data environment.
Perform analytical decision making and linking it to product performance…",https://sg.indeed.com/rc/clk?jk=372858472ab5d35a&fccid=f1f38920739951b9&vjs=3
FP&A Analyst,EMBED,Remote in Toa Payoh,EmployerActive 22 days ago,2022-05-18,"$60,000 - $65,000 a year","Competent in data visualization tools like Power BI/Tableau.
Able to work with big data and create financial models- SQL or other similar programming skills…",https://sg.indeed.com/company/EMBED/jobs/Fp-Analyst-e366c527dcbaaef6?fccid=f366b183449d00f5&vjs=3
Internship(Business Analyst),Titansoft Singapore,Singapore,Posted30+ days ago,2022-05-18,,"Acquiring the ability to analyze and draw insights in an ambiguous data environment.
Perform analytical decision making and linking it to product performance…",https://sg.indeed.com/rc/clk?jk=372858472ab5d35a&fccid=f1f38920739951b9&vjs=3
Data Migration Analyst - Talend,EY,Singapore,Posted22 days ago,2022-05-18,,"At least 2 complete cycles of data migration.
3+ years of skills in database and data migration principles.
Involve in data integration activities from upstream…",https://sg.indeed.com/rc/clk?jk=6858e715d3468dec&fccid=1544766d4c2915b0&vjs=3
Cloud Consultant / Business Analyst,Accion Labs,Singapore 049711,Posted30+ days ago,2022-05-18,,"Through nine global offices and a rapid-response delivery model, Accion offers a range of engagement models such as turn-key projects, extended-teams, shared-IP…",https://sg.indeed.com/rc/clk?jk=4aa032b3a3fb4fd7&fccid=aec4ab03366d46f3&vjs=3
Senior Data Analyst,NTUC LearningHub,Singapore,Posted9 days ago,2022-05-18,,"Perform data cleaning and ensure data quality and integrity in data warehouse.
Ensure company’s data policy, data security standard and data governance…",https://sg.indeed.com/rc/clk?jk=373322367df9f1f1&fccid=16a41f0de16f3742&vjs=3
Risk Insights Analyst Intern,TikTok,Singapore,Posted30+ days ago,2022-05-18,,"They work closely with advertisers to create ad policies, manage content review processes, and more.
Supporting risk analysis on markets, delivering the…",https://sg.indeed.com/rc/clk?jk=0b97f3de34e85a36&fccid=caed318a9335aac0&vjs=3
Management Trainee (Data Science & Analytics),DFS Group,Singapore,Posted30+ days ago,2022-05-18,,"Ability to extract critical data and generate actionable insights.
The Graduate Development program is designed to provide an unparalleled opportunity for…",https://sg.indeed.com/rc/clk?jk=416591f29c199ebd&fccid=2c27a35d679f26ae&vjs=3
Senior Data Analyst,Ascentis Pte Ltd,Singapore,Posted28 days ago,2022-05-18,,Build data pipelines (ETL/ELT flows) to retrieve data from various data sources and put them together in a data lake and data warehouse.,https://sg.indeed.com/rc/clk?jk=94152268c367e488&fccid=187c3a3b57d71b41&vjs=3
"Associate, Data Analysis",Singtel,Singapore 239732,Posted30+ days ago,2022-05-18,,"Work with internal & external business stakeholders on data requirements & ensure data integrity.
Ensure data cleaning and handling process are in accordance…",https://sg.indeed.com/rc/clk?jk=0a46e44893a815a3&fccid=a94c6bb50f118c9f&vjs=3
Partner Business Analyst,Amazon Web Services Singapore,Singapore,Posted30+ days ago,2022-05-18,,"Experience with data insights tools (e.g. www.salesforce.com) and data visualisation (e.g. QuickSight, Tableau).
Data driven but comfortable with ambiguity.",https://sg.indeed.com/rc/clk?jk=2eabe3d229c1680e&fccid=fe2d21eef233e94a&vjs=3
Business Intelligence Analyst - Global Fintech Start-up,Crypto.com,Singapore,Posted15 days ago,2022-05-18,,"Perform analysis and identify potential data pipeline optimizations.
1-3 years experience in data analytic and reporting role.
Assist in other ad-hoc reports.",https://sg.indeed.com/rc/clk?jk=59c516600782b3c0&fccid=18bfd14af40ab66a&vjs=3
"Financial Analyst, Regional FP&A",GfK,Singapore,Posted1 day ago,2022-05-18,,"In charge of APAC Regional cost pool on intercompany transactions.
Go-to person for time recording utilization and issues.",https://sg.indeed.com/rc/clk?jk=e1650626f7dcfb90&fccid=941c4fb004be80b8&vjs=3
"Back Office Support Analyst for CN market (Remote, Singapore)",Shopify,Remote in Singapore,Posted13 days ago,2022-05-18,,"Ability to synthesise available information and consume, interpret and present data points.
At least 2 years of experience in supporting a sales team with the…",https://sg.indeed.com/rc/clk?jk=d03b21e3836b01f5&fccid=d5a5824be27ba831&vjs=3
FY23 Analyst - Digital Transformation (SURF 2021),Deloitte,Singapore,Posted30+ days ago,2022-05-18,,"We are looking for computer science or data analytics undergraduates with excellent communications, inter-personal and critical thinking skills.",https://sg.indeed.com/rc/clk?jk=ff516e77d79034af&fccid=9e215d88a6b33622&vjs=3
Data Analyst,MOLOR PRO PTE. LTD.,Singapore,Posted18 days ago,2022-05-18,"$3,500 - $7,000 a month","Translate findings into visually compelling data stories.
Manage and support data requests from business stakeholders.
Experience with SQL, R, Python.",https://sg.indeed.com/rc/clk?jk=7a5468011f2e71c3&fccid=e2a5701eedcedb78&vjs=3
Data Analyst,MOLOR PRO PTE. LTD.,Singapore,Posted18 days ago,2022-05-18,"$3,500 - $7,000 a month","Translate findings into visually compelling data stories.
Manage and support data requests from business stakeholders.
Experience with SQL, R, Python.",https://sg.indeed.com/rc/clk?jk=7a5468011f2e71c3&fccid=e2a5701eedcedb78&vjs=3
Business Analyst,PACTERA SINGAPORE PTE. LTD.,Singapore,Posted5 days ago,2022-05-18,"$5,000 - $8,000 a month","Strong research and data collection skills.
3-5 years and above experiences in IT Banking Industry doing business consulting or business analyst.",https://sg.indeed.com/rc/clk?jk=b31f309c9488f400&fccid=f934973942fd0b96&vjs=3
Business Intelligence Intern,Shopee,Singapore,Posted30+ days ago,2022-05-18,,"Utilise SQL to efficiently extract correct data for end-users.
The Data Analytics team plays a critical role in conducting close-loop data-driven business…",https://sg.indeed.com/rc/clk?jk=530a3df411e31458&fccid=0b476c4a7add47fe&vjs=3
Media Content Reporting Analyst,Accenture,Singapore,Posted30+ days ago,2022-05-18,,"As a Media Content Reporting Analyst, you will work closely with Operations, to help monitor Incoming volumes In Queues, report on Daily attendance schedule…",https://sg.indeed.com/rc/clk?jk=5772f637eb0d1724&fccid=a4e4e2eaf26690c9&vjs=3
"VP, Business Data Analyst",United Overseas Bank Limited,Raffles,Posted30+ days ago,2022-05-18,,"Knowledge of big data ecosystems (e.g. Hue, Hive, Impala), SQL, data warehousing, and data modelling a strong plus.
Knowledge of finance/risk data in banking.",https://sg.indeed.com/rc/clk?jk=1c9ab30f6cd0b51a&fccid=b1ace17c9d00764e&vjs=3
Support Analyst (Energy Trading & Risk Mgmt),CoreTRM Pte. Ltd.,Singapore,Posted5 days ago,2022-05-18,"$4,000 - $4,140 a month","Due to rapid expansion and business needs, we are now looking for a support analyst to assist clients using our software/platform.",https://sg.indeed.com/company/CoreTRM-Pte.-Ltd./jobs/Support-Analyst-c92e2679116e59fd?fccid=68a696313e6bf67e&vjs=3
"LIQUIDITY ANALYST, APAC",360 Treasury Systems,Singapore,Posted10 days ago,2022-05-18,,"Analysing data to look for opportunities and trends.
Strong analytical mindset, well versed with advanced excel skills and able to manipulate large amounts of…",https://sg.indeed.com/rc/clk?jk=7456646492ccfd21&fccid=85e2cb1cb1389c8d&vjs=3
Investment Analyst,AAM Advisory Pte Ltd,Singapore,Posted30+ days ago,2022-05-18,,"Ensuring the accuracy of investment related data.
Independent worker and analytical thinker with ability to conduct research, data analysis and resolve complex…",https://sg.indeed.com/rc/clk?jk=dcb04c9f98f8cc87&fccid=9f4a1699b8f2569b&vjs=3
Senior Investment & Quant Analyst,ENDOW.US PTE. LTD.,Singapore,Posted7 days ago,2022-05-18,"$6,400 - $12,800 a month","Minimum 2~5 years work in a financial institution of relevance for investment & quant analyst role.
For the quant analyst 1) quant data analytics with knowledge…",https://sg.indeed.com/rc/clk?jk=ddc5b030647aa272&fccid=dc9bfb03fddcb981&vjs=3
Data Solutions Analyst,Good Job Creations Pte Ltd,Singapore,Hiring ongoing,2022-05-18,,"Must be comfortable and familiar with big data.
Identify and implement data validation criteria on project datasets.
Recruit and manage analysts if required.",https://sg.indeed.com/company/Good-Job-Creations-Pte-Ltd/jobs/Data-Solution-Analyst-f735cca543ebcba2?fccid=ee772c366e311477&vjs=3
Senior Data Analyst - Trade Compliance/Customs,Cargill,Singapore,Posted30+ days ago,2022-05-18,,"Respond to complex ad hoc data requests.
In this position, you'll demonstrate familiarity with business technology concepts, data management and decision…",https://sg.indeed.com/pagead/clk?mo=r&ad=-6NYlbfkN0BVweAbpb_qTG7kONbvOXWOFpMik4mIBI_owmbH0tVOH8GIYTflTy_o4IUi18-ZUUxOVbMqKByUrknQefam2oYPAF-EVUrg7j-ktLqIVSTCcUYq2bkm9B-kB_Paxv0DWDpX6B3_nWK5sBhFwqJXm-wrFaS9H11qA2xf3lIF48vMlXa-5J6JH5V0QbOQWMmOnGV6DR5NTTh96PzeIj13ADL1cxwS8-rq5qQTja0QVmm14yLhiuGH9LZ9Z45knXh-iBwlNwAYPQmRjvPZ2S8bwSFwy2_E2PTwkJAbOxTCkfLkl7DeYPEWBufTZRuqJUsWJzMby7H5bO32VoiMUZEOzrXZPjji6tZ0XdwCSAJY5aGJc1iJo_JLOHG0kvP6jppbm_VIiM_uPq2-PG0zZvYVP195rQNe6GYnVM66ENeDHKe6Ul-atKfgJXa_Q83t0gsSReyPM_AMRb7C72tSJjEELYS6YR2gMnc8dEDF3WLy0PIG4m6XYYPScCVfNwxd9ibbG1OjO4wmrzQElyoBBQccepoz6deOQ9wR-feWdlKrhl2lUkZRpyn28X-tgoWfxhPxPiaef6NuZbAIhd4MGAjTKmVJtkAabXkXNJ5ezUpr6YAUXKookh9NNnRsIwdwiROJW9cjEqVL_mQmVTgnPAiVvaLtdoB6C1UmknAEwbYZ3pZT57JVIXZTmg_d-oBQaMarJpDEUavDo61iU92VuQFYqoO5GCY79KmuhB7VggBvDoCwxgaCrjBErXTgmCgLzIUZk4BZUYOpYTz3Npb86GKZ65Ody8kLE7PicUpB_xjocBJ6cMGjO8fNja32xZDnTzXEgmc8OxFqGa_yWF8AjEq1Sy6BRlWOYA1CCWgnjQ-Qc1pI6w==&p=10&fvj=0&vjs=3
Business Analyst - Digital,NEC ASIA PACIFIC PTE. LTD.,Singapore,Posted6 days ago,2022-05-18,"$4,000 - $6,200 a month","Develop and maintain documentation on business input and translation into visual models (Business domain model, process flow diagrams, use case diagrams,…",https://sg.indeed.com/rc/clk?jk=05ab65cba692fcc5&fccid=cd106fcc81f9985b&vjs=3
Data Analyst - Commerce Enablement,GO-JEK,Singapore,Posted30+ days ago,2022-05-18,,"You’ll process data streams to produce data foundation, analytical dashboards, and product/feature trackers on a daily basis.",https://sg.indeed.com/rc/clk?jk=825565a12c586aa6&fccid=35c79097c1f63f3d&vjs=3
Supply Chain Analyst,Nike,Singapore,Posted30+ days ago,2022-05-18,,"Strong problem solving and root cause analysis skills in massive and complex data systems.
This person is perceptive to systematic outages and data errors,…",https://sg.indeed.com/rc/clk?jk=0d6e6b0c367e4e3c&fccid=2c62e4de04b8f952&vjs=3
Senior Data Analyst - NuData Integration,MasterCard,Singapore,Posted30+ days ago,2022-05-18,,"Strong data analysis and data modelling skills;
Experience dealing with large data sets;
Intermediate level of data analysis and reporting experience in…",https://sg.indeed.com/rc/clk?jk=9cdaf945adc988b0&fccid=10b5c722d846df43&vjs=3
Quantitative Analyst,NAVIK CAPITAL (SINGAPORE) PTE. LTD.,Singapore,Posted5 days ago,2022-05-18,"$6,000 - $12,000 a month","About 2-3 years in a bank as associate or analyst preferable.
Our strategy combines a proprietary statistical analytical framework with local markets…",https://sg.indeed.com/rc/clk?jk=e49a7f2f71a7f63a&fccid=e417ceb16d4b9c6c&vjs=3
ETF Analyst,Hudson River Trading,Singapore,Posted30+ days ago,2022-05-18,,"Onboarding new data sources and enriching the existing suite of ETF datasets.
Investigating and documenting systematic errors in data pipeline processes,…",https://sg.indeed.com/rc/clk?jk=d30a8eca147c1ef0&fccid=01b91641951e8886&vjs=3
Retail Finance - Credit Risk Analyst Intern,SeaMoney,Singapore,Posted9 days ago,2022-05-18,,Assist in consolidating data from multiple sources to create integrated views that can be used to drive data-driven risk management decisions.,https://sg.indeed.com/rc/clk?jk=685a1085b041cd69&fccid=04cf7b87da0c2ba4&vjs=3
Senior Data Analyst - Marketing Analytics (External Media),Shopee,Singapore 118265+1 location,Posted30+ days ago,2022-05-18,,"With support from data engineers, work with big data at Shopee using Hadoop ecosystem.
Passionate about data and solving challenging problems.",https://sg.indeed.com/rc/clk?jk=8e8a5b450a16e7f0&fccid=0b476c4a7add47fe&vjs=3
Business Analyst,Amazon Asia-Pacific Holdings,Singapore,Posted30+ days ago,2022-05-18,,"3+ years of relevant experience in a business analyst/data analyst/statistical analysis role.
Understanding of data warehousing and data modeling.",https://sg.indeed.com/rc/clk?jk=47c8b5af4d026471&fccid=fe2d21eef233e94a&vjs=3
"VP, Business Data Analyst, Data Management Office",,Central Singapore,Posted30+ days ago,2022-05-18,,"Vp business data analyst data management office.
We govern the use of data across the Group and provide guidance for data management and usage.",https://sg.indeed.com/rc/clk?jk=595bec01423e6d38&fccid=dd616958bd9ddc12&vjs=3
Data Migration Analyst / Engineer,RGP,Remote in Singapore,Posted30+ days ago,2022-05-18,"$2,000 a month","Immediate Start, For At Least 6 Months.
The skillsets relevant would be Data Migration Engineer/Developer.
 Plan, coordinate, develop and support ETL processes…",https://sg.indeed.com/rc/clk?jk=42d78402fbc6a5eb&fccid=fe4b89f22f996d41&vjs=3
Business Process (Systems) Analyst,ICON SOC PTE. LTD.,Singapore,Posted12 days ago,2022-05-18,"$5,000 - $6,000 a month","Undertake data cleaning on data sets and develop policies and procedures to maintain clean data.
Experience in working with data systems, data processing and…",https://sg.indeed.com/rc/clk?jk=535fd6867c09411f&fccid=38122d2aebe1155e&vjs=3
"Business Analyst, Technology & Operations",DBS Bank,Singapore,Posted30+ days ago,2022-05-18,,"Strong knowledge in market data.
Facilitate requirements workshops to engage the various stakeholders such as Front Office, Middle Office, Finance users to…",https://sg.indeed.com/rc/clk?jk=086c0ba29f793192&fccid=cc1f9ea511d140fe&vjs=3
Regional BI - Data Analyst,Shopee,Singapore,Posted30+ days ago,2022-05-18,,"Resourceful problem solver, able to problem solve using data.
Work with big data at Shopee using the Hadoop ecosystem (pyspark, presto, clickhouse, etc), gather…",https://sg.indeed.com/rc/clk?jk=c07c9c8aeff2dc64&fccid=0b476c4a7add47fe&vjs=3
IT Business Intelligence Engineer,The Coca-Cola Company,Singapore,Posted8 days ago,2022-05-18,,"Design, implement and operationalize data pipelines, data warehouses and semantic models in data marts using Azure Data Services (ADF, Synapse, CosmosDB, Spark…",https://sg.indeed.com/rc/clk?jk=0b09ad7d05d57842&fccid=6bb4fc4a8a4cb4d9&vjs=3
Data Analyst (Junior),TECHKNOWLEDGEY PTE. LTD.,Singapore,Posted14 days ago,2022-05-18,"$4,000 - $5,000 a month","Good understanding of data structure, database and data modeling.
Identify source of data and work with Data Engineers to create datasets for analytics projects…",https://sg.indeed.com/rc/clk?jk=45e7cc19f52220b8&fccid=d237dd1321f44b0b&vjs=3
Citi Private Bank - Client Onboarding Analyst,Citi,Singapore,Posted7 days ago,2022-05-18,,"Applies professional judgment when interpreting data and results.
Applies analytical thinking and knowledge of data analysis tools and methodologies.",https://sg.indeed.com/rc/clk?jk=027ac423741250c5&fccid=5bcd1ef0a7f4fb99&vjs=3
"Business Analyst , ASEAN SSOE Team",Amazon Web Services Singapore,Singapore,Posted30+ days ago,2022-05-18,,"+ Expertise in data visualization software (QuickSight, Tableau, PowerBI, QlikView, etc.) for effective data presentation.",https://sg.indeed.com/rc/clk?jk=a8484cff838edd8b&fccid=fe2d21eef233e94a&vjs=3
"Quantitative Strategist, Analyst/ Associate",Morgan Stanley,Singapore,Posted30+ days ago,2022-05-18,,"The commodities business is looking for a quantitative strategist located in Singapore, to support the local Sales and Trading Desk.",https://sg.indeed.com/rc/clk?jk=3cc26f225acb878d&fccid=0c39fb2c91742dcf&vjs=3
IT Business Analyst Internships (May to Aug 2022) - Singapore,Dyson,Singapore,Posted30+ days ago,2022-05-18,,"We are looking for penultimate year students, graduating in 2023 and who would be able to commit full-time for either one of the following periods:",https://sg.indeed.com/rc/clk?jk=6c4e30f01851b106&fccid=366382f52796fce2&vjs=3
"Analyst, CPHRI (Contract)",SingHealth,Singapore,Posted30+ days ago,2022-05-18,,You will support the department’s analytic function by managing large volumes of data in adherence to data governance standards.,https://sg.indeed.com/rc/clk?jk=dd197745a260970d&fccid=dcae8df142b2a793&vjs=3
Supply Chain Analyst,NOV RIG SOLUTIONS PTE. LTD.,Singapore,Posted7 days ago,2022-05-18,"$6,275 - $8,191 a month",Collaborate with Production Planning Control (PPC) analysts and procurement/ purchasing teams at NOV Rig Technologies Manufacturing and Spares groups to ensure…,https://sg.indeed.com/rc/clk?jk=ca4b7e4c4f4f541c&fccid=cec69c9f620cc5dc&vjs=3
Business Intelligence Intern,GN Hearing,Remote in Singapore,Posted7 days ago,2022-05-18,"$1,000 a month","Flexible Start, For At Least 5 Months.
Channel and customer analysis for commercial excellence.
Data-analytics for consumer-focused lead-generation.",https://sg.indeed.com/rc/clk?jk=aa2bda5e8134dfaf&fccid=1903b3567e008f55&vjs=3
